respondent_id,country,province,district,village,survey_date,interviewer_name,fj_survey_number,group_rules.group_other_rules.other_break_rules,group_mgmt_personal.effect_yn_personal,group_mgmt_personal.benefits_personal,group_mgmt_personal.costs_personal,group_mgmt_personal.impact_personal,group_mgmt_community.effect_yn_community,group_mgmt_community.benefits_community,group_mgmt_community.costs_community,group_mgmt_community.impact_community,mgmt_who_most_positively,mgmt_who_most_negatively
491,Fiji,Bua,Kubulau,Navatu,2016-11-16,Luke,83,NA,yes,Village financial gathering are being accessed from the tabu (soli va misinare) and plenty fish for the family,none so far,good,no,NA,NA,NA,each every family,none
114,Fiji,Bua,Bua,Bua Lomanikoro,2016-11-18,Wise,104,NA,no,NA,NA,NA,yes,None,Some of them have to travel far to be able to fish adn they pay a lot of money for fuel,bad,no one because have not seen any benefits,the community or fisherman because they have to pay more for fuel
1165,Fiji,Lomavaiti,Levuka,Arovudi,2016-11-03,Wise,32,NA,yes,NA,None,very_good,yes,The things that we don't see before now we can see it. It's in the tabu,None,very_good,It will be our future generation who will be postively affected because there will be fish for them,no one
2059,Fiji,Lomavaiti,Levuka,Arovudi,2016-11-03,Wise,33,NA,no,N/A,N/A,NA,no,N/A,N/A,NA,NA,NA
1741,Fiji,Bua,Kubulau,Navatu,2016-11-16,Luke,80,NA,yes,When there is a village gatherings we basically get food from the Taboo areas and dont have to worry about the food,"People of Navatu basically live and depend on the sea with, taboo being implemented they usually faces alot of problem with having access to the sea",good,yes,Basically when there is a village function people of Navatu usually get food from the Taboo area,none,good,Community,none
83,Fiji,Bua,Bua,Bua Lomanikoro,2016-11-18,Tarusila,95,NA,yes,Abundance of food fish,Limited space for non-MPA boundary to fish,neutral,yes,Abundance of catch is a source of income,Poaching is becoming really apparent,neutral,The whole community,The whole community - cause oft he distance to new fishing spots
1610,Fiji,Lomavaiti,Levuka,Arovudi,2016-11-03,Wise,34,NA,yes,I can buy big fish from people who fish in our area and I am happy to see that I'm buying big fish,None,very_good,yes,"Some people are not employed but they get the money from selling fish, and there are a lot of fish",None,very_good,The fisherman,No one
921,Fiji,Ra,Nakorotubu,Nabukadra,2016-11-28,Wise,114,NA,yes,NA,NA,NA,no,NA,NA,NA,No one,No one
621,Fiji,Lomavaiti,Levuka,Arovudi,2016-11-03,Wise,35,NA,yes,I know there will be fish for future generations and I am happy about that,none,very_good,yes,We know that we can leave something for our future generations,none,very_good,the whole village and our future generations,no one
889,Fiji,Ra,Nakorotubu,Nabukadra,2016-11-28,Wise,115,NA,no,None,Distance to new fishing spot,neutral,no,None,Members of the village have to travel far to new fishing spots,bad,The poachers,The whole community
218,Fiji,Bua,Bua,Dalomo,2016-11-18,Wise,110,NA,yes,he is able to catch what ever fish comes out of the tabu,none,very_good,yes,we are able to eat fish everyday,none,very_good,the fishers from Bua,no one
1700,Fiji,Ra,Nakorotubu,Nadogoloa,2016-11-04,Wise,47,NA,no,N/A,N/A,NA,yes,none at all,We have to travel far to catch fish for our family,very_bad,no one,the whole community
775,Fiji,Ra,Nakorotubu,Nabukadra,2016-11-28,Luke,117,NA,no,can not see changes due to management,can not see changes due to management,neutral,no,can not see changes due to management,can not see changes due to management,NA,not too sure,not to sure
2108,Fiji,Bua,Bua,Bua Lomanikoro,2016-11-18,Luke,87,NA,yes,Recovery of food fish in terms of abundance and diversity,Non-MPA boundary is becoming smaller for fishing and hence less fish is captured,very_good,yes,"For some in the community, fishing is their main source of income",MPA has been closed for to long,very_good,The whole community,"Community, in terms of distanced and fuel needed to travel to further fishing spots"
1797,Fiji,Bua,Bua,Dalomo,2016-11-18,Wise,111,NA,no,N/A,N/A,NA,no,N/A,N/A,NA,the chiefs because they receive money from middlemen and chinese to collect sea cucumbers,the common people because they have to share their fishing ground with outsiders
246,Fiji,Ra,Nakorotubu,Nadogoloa,2016-11-04,Wise,48,NA,no,N/A,N/A,NA,no,N/A,N/A,very_bad,the peple of Nagavatoka becuase they poach in our tabu,The people and fisherman of Nadogoloa
1992,Fiji,Ra,Nakorotubu,Nadogoloa,2016-11-04,Wise,49,most,no,N/A,N/A,NA,no,N/A,N/A,NA,The poachers from Malake. Because they poach in our tabu and sell the fish,the whole village because the tabu isn't enforced and there are poachers
330,Fiji,Bua,Kubulau,Navatu,2016-11-16,Luke,78,NA,yes,Plenty of fish to feed the family and other villagers; income generation from fishing,none,good,yes,every community within the village,none,good,their family because they are allowed to fish in the tabu when they are in real need (food scarcity),no one
877,Fiji,Ra,Nakorotubu,Nadogoloa,2016-11-04,Wise,50,NA,no,N/A,N/A,NA,no,N/A,N/A,very_bad,No one,the villages of Nadogoloa because we have to travel far to catch fish
2163,Fiji,Ra,Nakorotubu,Nabukadra,2016-11-28,Luke,119,NA,yes,source of food during special occasions,none,good,yes,source of food during special occasions,They face alot off financial constraints from the taboo because most of the famillies depend on the sea for their livelihood and also source of money,good,everyone benefited from the taboo in this area,no one
1881,Fiji,Bua,Kubulau,Navatu,2016-11-16,Luke,79,NA,yes,they use the money from selling fish from tabu to pay the church levy; they also use to provide food in special occasions,none,very_good,yes,they use the money from selling fish from tabu to pay the church levy; they also use to provide food in special occasions,none,good,everyone in the village,no one
1832,Fiji,Ra,Nakorotubu,Nabukadra,2016-11-28,Luke,118,NA,yes,Abundance of fish and invertebrates,"Increasing number of households in the village, probably the non-tabu boundary will not cater for everyone",very_good,yes,Abundance of fish during special village occasion,None,very_good,The whole community,None
1509,Fiji,Ra,Nakorotubu,Nadogoloa,2016-11-16,Luke,59,NA,yes,more fish for the family consumptions,nome,good,yes,alot of food,none,good,villages as a whole,none
738,Fiji,Bua,Kubulau,Navatu,2016-11-15,MFox,85,NA,yes,"Dromuninuku Tabu - assist in church fundraisers; Namena Marine Reserve - $3,000/yr is given to teh villge of Navatu for """"compensation"""" & also there's a scholarship fund",Fishing area is being displaced,very_good,yes,"Dromuninuku Tabu - assist in church fundraisers; Namena Marine Reserve - $3,000/yr is given to teh villge of Navatu for """"compensation"""" & also there's a scholarship fund",Fishing area is being displaced,very_good,Everybody in village benefits,No one
1212,Fiji,Bua,Bua,Bua Lomanikoro,2016-11-18,Tarusila,105,NA,yes,"more fish, more coral, healthy mangroves",poaching,very_good,yes,people follow the rules and this increases their unity,some people are selfish and break the rules,good,the community: there is more fish (spillover from tabu) and they spend less time fishing,no answer
2174,Fiji,Ra,Nakorotubu,Nadogoloa,2016-11-04,ELogan,52,NA,no,None,I believe this tabu is benefiting the poachers the most and also our women have to travel a great distance to new fishing spot,neutral,no,None,People still breaking the rules and increase in poachers,bad,Poachers,The whole village
988,Fiji,Lomavaiti,Levuka,Arovudi,2016-11-03,Luke,43,NA,yes,Plenty fish and variety fish species,none,good,yes,plenty fish and variety fish species,none,good,community,none